rank,candidate_id,reasoning,specific_facts_pass,jd_connection_pass,honest_concerns_pass,no_hallucination_pass,rank_consistency_pass,variation_pass,automated_review_pass
62,CAND_0006567,"Hiring-risk adjusted fit: 7.9 years at this level matter because Meta's Senior AI Engineer record includes Python engineering via Python - 68 months - expert, shipped, users, and 2 relevant product roles. Recruiting viability is strong: 79% response, open to work, last active 2026-05-03; primary concerns: missing evidence for Embeddings & semantic retrieval, 60-day notice.",True,True,True,True,True,True,True
63,CAND_0065195,"Technical delivery read: Ranking confidence comes from Python engineering via scikit-learn - 74 months - expert plus delivery markers (production, monitoring). Search Engineer at CRED brings 5.1 years and 1 relevant product role. Recruiting viability is strong: 80% response, open to work, last active 2026-05-24; primary concerns: missing evidence for Ranking evaluation, 45-day notice.",True,True,True,True,True,True,True
64,CAND_0081686,"Requirement-match signal: Search Engineer at Netflix earns this position through Python engineering via Python - 78 months - expert. The career record spans 6 years and includes 3 relevant product roles plus serving, users. Availability is mixed: 91% response, not marked open to work, last active 2026-04-25; primary concerns: 60-day notice.",True,True,True,True,True,True,True
65,CAND_0058575,"Technical delivery read: The practical hiring signal is Embeddings & semantic retrieval via Sentence Transformers - 45 months - expert, supported by production, monitoring. Krutrim's AI Engineer profile has 5.8 years overall and 3 relevant product roles. Recruiting viability is strong: 69% response, open to work, last active 2026-04-05; primary concerns: 90-day notice.",True,True,True,True,True,True,True
66,CAND_0036184,"Hands-on Recommendation Systems Engineer evidence: The profile's practical AI/search fit comes from Python engineering via PyTorch - 77 months - expert. Recommendation Systems Engineer at CRED has 6 years total and 2 relevant product roles; delivery markers include no explicit production marker. Recruiting viability is strong: 90% response, open to work, last active 2026-05-26; primary concerns: missing evidence for Ranking evaluation.",True,True,True,True,True,True,True
67,CAND_0074225,"Career-signal synthesis: Evidence quality is led by Python engineering via Python - 71 months - expert. Current work as Machine Learning Engineer at Unacademy sits inside a 4.3-year path with shipped, a/b and 1 relevant product role. Recruiting viability is strong: 91% response, open to work, last active 2026-05-20; primary concerns: 4.3 years versus 5-year target, 120-day notice.",True,True,True,True,True,True,True
68,CAND_0009024,"Evidence-first ranking: Recruiter-facing evidence starts with Vector & hybrid search via OpenSearch - 90 months - expert. Google's Search Engineer profile has 5.2 years overall, serving, users, and 2 relevant product roles. Availability is mixed: 46% response and last active 2026-04-09; no major concern detected.",True,True,True,True,True,True,True
69,CAND_0069905,"Applied ML Engineer delivery record: Applied ML Engineer at Sarvam AI earns this position through Python engineering via Python - 42 months - expert. The career record spans 6.6 years and includes 2 relevant product roles plus no explicit production marker. Recruiting viability is strong: 78% response, open to work, last active 2026-04-21; primary concerns: 90-day notice.",True,True,True,True,True,True,True
70,CAND_0040117,"Requirement-match signal: This profile connects Embeddings & semantic retrieval via Embeddings - 63 months - expert with serving, users. Its 6.5-year path currently lands at PhonePe as Recommendation Systems Engineer and shows 1 relevant product role. Recruiting viability is strong: 66% response, open to work, last active 2026-03-17; primary concerns: missing evidence for Python engineering.",True,True,True,True,True,True,True
71,CAND_0054394,"Recruiter screen signal: The candidate's strongest verifiable thread is Python engineering via scikit-learn - 95 months - expert. Current title is Recommendation Systems Engineer at PharmEasy, with 4.1 years and 2 relevant product roles. Recruiting viability is strong: 64% response, open to work, last active 2026-05-04; primary concerns: 4.1 years versus 5-year target.",True,True,True,True,True,True,True
72,CAND_0076831,"Candidate evidence stack: The candidate's strongest verifiable thread is Python engineering via PyTorch - 40 months - expert. Current title is Search Engineer at Krutrim, with 4 years and 2 relevant product roles. Availability is mixed: 50% response and last active 2026-05-14; primary concerns: 4 years versus 5-year target, 90-day notice.",True,True,True,True,True,True,True
73,CAND_0093912,"Career-signal synthesis: 5.3 years at this level matter because Razorpay's Senior Data Scientist record includes Vector & hybrid search via Vector Search - 80 months - expert, no explicit production marker, and 3 relevant product roles. Recruiting viability is strong: 66% response, open to work, last active 2026-05-11; primary concerns: missing evidence for Ranking evaluation.",True,True,True,True,True,True,True
74,CAND_0011327,"Career-context read: AI Research Engineer at Krutrim stands out through Python engineering support from career-history evidence for Python/ML framework usage. The 6.3-year career record pairs production, serving with 2 relevant product roles. Recruiting viability is strong: 79% response, open to work, last active 2026-05-25; primary concerns: missing evidence for Ranking evaluation, 60-day notice.",True,True,True,True,True,True,True
75,CAND_0043860,"Role-specific proof: Aganitha's Junior ML Engineer profile is shortlisted because Embeddings & semantic retrieval via Semantic Search - 44 months - advanced is backed by production. The career span is 6.1 years with 1 relevant product role. Recruiting viability is strong: 81% response, open to work, last active 2026-05-26; primary concerns: missing evidence for Ranking evaluation.",True,True,True,True,True,True,True
76,CAND_0060054,"Career delivery proof: Recruiter-facing evidence starts with Embeddings & semantic retrieval via Semantic Search - 70 months - expert. Mad Street Den's AI Engineer profile has 6.4 years overall, shipped, serving, and 3 relevant product roles. Availability is mixed: 86% response, not marked open to work, last active 2026-03-17; primary concerns: missing evidence for Python engineering.",True,True,True,True,True,True,True
77,CAND_0044883,"System-building thread: The role match is strongest where Python engineering via PyTorch - 86 months - expert intersects with production, shipped. Mad Street Den lists this candidate as AI Engineer, with 6.3 years and 3 relevant product roles. Availability is mixed: 84% response, not marked open to work, last active 2026-05-07; primary concerns: 90-day notice.",True,True,True,True,True,True,True
78,CAND_0042029,"System-building thread: Career trajectory is relevant because Senior Data Scientist at Flipkart combines Python engineering via PyTorch - 90 months - expert with shipped, a/b. Total experience is 6.5 years and product context is 1 relevant product role. Availability is mixed: 67% response, not marked open to work, last active 2026-04-13; primary concerns: 45-day notice.",True,True,True,True,True,True,True
79,CAND_0066376,"Dream11 product evidence: Evidence is not just keyword overlap: Vector & hybrid search via FAISS - 84 months - expert is paired with serving, users. The profile is a 5.7-year Applied ML Engineer at Dream11 with 2 relevant product roles. Availability is mixed: 51% response and last active 2026-05-03; primary concerns: missing evidence for Python engineering, 90-day notice.",True,True,True,True,True,True,True
80,CAND_0037944,"Senior Data Scientist delivery record: The role match is strongest where Python engineering via Python - 96 months - expert intersects with shipped, a/b. Vedantu lists this candidate as Senior Data Scientist, with 4.9 years and 1 relevant product role. Availability is mixed: 42% response and last active 2026-03-22; primary concerns: 4.9 years versus 5-year target.",True,True,True,True,True,True,True
81,CAND_0009691,"Requirement-match signal: The candidate's strongest verifiable thread is Vector & hybrid search via Qdrant - 63 months - expert. Current title is Applied ML Engineer at LinkedIn, with 6.2 years and 3 relevant product roles. Recruiting viability is strong: 64% response, open to work, last active 2026-05-16; primary concerns: 120-day notice.",True,True,True,True,True,True,True
82,CAND_0031593,"Operational fit signal: Genpact AI's Search Engineer profile is shortlisted because Embeddings & semantic retrieval via Embeddings - 94 months - expert is backed by serving, users. The career span is 7.8 years with 2 relevant product roles. Availability is mixed: 58% response and last active 2026-03-19; primary concerns: missing evidence for Python engineering, 90-day notice.",True,True,True,True,True,True,True
83,CAND_0022023,"Availability-adjusted fit: AI Research Engineer at Saarthi.ai earns this position through Python engineering support from career-history evidence for Python/ML framework usage. The career record spans 4.6 years and includes 2 relevant product roles plus production, serving. Availability is mixed: 47% response and last active 2026-05-19; primary concerns: 4.6 years versus 5-year target, missing evidence for Ranking evaluation, 60-day notice.",True,True,True,True,True,True,True
84,CAND_0078042,"Candidate evidence stack: PolicyBazaar's Applied ML Engineer profile is shortlisted because Python engineering via PyTorch - 38 months - expert is backed by shipped, a/b. The career span is 4.7 years with 2 relevant product roles. Availability is mixed: 91% response, not marked open to work, last active 2026-04-24; primary concerns: 4.7 years versus 5-year target.",True,True,True,True,True,True,True
85,CAND_0018722,"Recommendation Systems Engineer shortlist case: Evidence quality is led by Python engineering via Python - 51 months - expert. Current work as Recommendation Systems Engineer at Saarthi.ai sits inside a 6.6-year path with no explicit production marker and 3 relevant product roles. Recruiting viability is strong: 79% response, open to work, last active 2026-04-24; primary concerns: 90-day notice.",True,True,True,True,True,True,True
86,CAND_0061265,"Recommendation Systems Engineer shortlist case: Evidence quality is led by Embeddings & semantic retrieval via Embeddings - 57 months - expert. Current work as Recommendation Systems Engineer at Zoho sits inside a 6.6-year path with production, monitoring and 2 relevant product roles. Recruiting viability is strong: 94% response, open to work, last active 2026-03-25; primary concerns: missing evidence for Ranking evaluation, 120-day notice.",True,True,True,True,True,True,True
87,CAND_0042100,"Recruiting-practical match: The role match is strongest where Vector & hybrid search via Pinecone - 69 months - expert intersects with shipped, a/b. Freshworks lists this candidate as Machine Learning Engineer, with 7.3 years and 2 relevant product roles. Recruiting viability is strong: 87% response, open to work, last active 2026-03-23; primary concerns: 90-day notice.",True,True,True,True,True,True,True
88,CAND_0061257,"LinkedIn AI trajectory: LinkedIn's Staff Machine Learning Engineer profile is shortlisted because Python engineering via Python - 72 months - expert is backed by production, users. The career span is 8 years with 2 relevant product roles. Recruiting viability is strong: 87% response, open to work, last active 2026-04-16; primary concerns: missing evidence for Embeddings & semantic retrieval.",True,True,True,True,True,True,True
89,CAND_0044222,"Skill-depth evidence: AI Engineer at PolicyBazaar stands out through Vector & hybrid search via OpenSearch - 75 months - expert. The 7.7-year career record pairs shipped, a/b with 2 relevant product roles. Recruiting viability is strong: 60% response, open to work, last active 2026-05-15; primary concerns: missing evidence for Python engineering, 60-day notice.",True,True,True,True,True,True,True
90,CAND_0011432,"Recruiting-practical match: Senior Data Scientist at Amazon brings 7.6 years of experience. The clearest match is Vector & hybrid search via OpenSearch - 59 months - advanced; the record adds 2 relevant product roles and shipped, a/b. Recruiting viability is strong: 67% response, open to work, last active 2026-03-16; primary concerns: missing evidence for Python engineering, 60-day notice.",True,True,True,True,True,True,True
91,CAND_0037980,"Senior Applied Scientist shortlist case: The role match is strongest where Python engineering via PyTorch - 63 months - expert intersects with production, shipped. Niramai lists this candidate as Senior Applied Scientist, with 9 years and 3 relevant product roles. Recruiting viability is strong: 63% response, open to work, last active 2026-03-28; primary concerns: missing evidence for Embeddings & semantic retrieval.",True,True,True,True,True,True,True
92,CAND_0057563,"System-building thread: Ranking confidence comes from Embeddings & semantic retrieval support from career-history evidence for semantic retrieval work plus delivery markers (serving, users). NLP Engineer at Locobuzz brings 6.8 years and 3 relevant product roles. Availability is mixed: 83% response, not marked open to work, last active 2026-04-21; primary concerns: missing evidence for Python engineering, 60-day notice.",True,True,True,True,True,True,True
93,CAND_0026532,"4.8-year senior fit: For a founding Senior AI Engineer role, Vector & hybrid search via Milvus - 60 months - expert is the key match. Recommendation Systems Engineer at Zomato adds 4.8 years of experience, serving, users, and 2 relevant product roles. Availability is mixed: 52% response and last active 2026-03-28; primary concerns: 4.8 years versus 5-year target, missing evidence for Python engineering, 90-day notice.",True,True,True,True,True,True,True
94,CAND_0062413,"Operational fit signal: The ranking case is built on Vector & hybrid search via OpenSearch - 29 months - advanced, not title alone. AI Research Engineer at upGrad has 6.6 years of experience plus 2 relevant product roles and production. Recruiting viability is strong: 71% response, open to work, last active 2026-04-06; primary concerns: missing evidence for Ranking evaluation, 60-day notice.",True,True,True,True,True,True,True
95,CAND_0004402,"Evidence-first ranking: The practical hiring signal is Python engineering via PyTorch - 32 months - advanced, supported by production. Yellow.ai's AI Research Engineer profile has 6 years overall and 1 relevant product role. Recruiting viability is strong: 83% response, open to work, last active 2026-05-25; primary concerns: missing evidence for Ranking evaluation, 60-day notice.",True,True,True,True,True,True,True
96,CAND_0027801,"Evidence-first ranking: For a founding Senior AI Engineer role, Vector & hybrid search via FAISS - 80 months - expert is the key match. NLP Engineer at InMobi adds 7.4 years of experience, production, monitoring, and 2 relevant product roles. Recruiting viability is strong: 65% response, open to work, last active 2026-04-12; primary concerns: 120-day notice.",True,True,True,True,True,True,True
97,CAND_0070398,"Genpact AI AI trajectory: The role match is strongest where Vector & hybrid search via FAISS - 90 months - expert intersects with shipped, a/b. Genpact AI lists this candidate as Machine Learning Engineer, with 7.2 years and 3 relevant product roles. Recruiting viability is strong: 60% response, open to work, last active 2026-04-14; primary concerns: 120-day notice.",True,True,True,True,True,True,True
98,CAND_0053591,"Career-context read: Shortlist evidence for AI Engineer at Ola centers on Embeddings & semantic retrieval via Sentence Transformers - 63 months - expert. The profile shows 5.3 years of work, shipped, a/b, and 1 relevant product role. Recruiting viability is strong: 81% response, open to work, last active 2026-05-17; primary concerns: missing evidence for Python engineering, 60-day notice.",True,True,True,True,True,True,True
99,CAND_0045250,"Shortlist quality marker: The ranking case is built on Vector & hybrid search via Vector Search - 82 months - expert, not title alone. Applied ML Engineer at Rephrase.ai has 6.6 years of experience plus 1 relevant product role and production, shipped. Availability is mixed: 74% response, not marked open to work, last active 2026-04-29; primary concerns: missing evidence for Python engineering.",True,True,True,True,True,True,True
100,CAND_0048558,"Requirement-match signal: The practical hiring signal is Vector & hybrid search via Qdrant - 42 months - advanced, supported by production, serving. Rephrase.ai's Data Scientist profile has 6.7 years overall and 1 relevant product role. Recruiting viability is strong: 80% response, open to work, last active 2026-05-27; primary concerns: missing evidence for Embeddings & semantic retrieval.",True,True,True,True,True,True,True
